{
  "schema_version": "2.0.0",
  "source_id": "SYNTHETIC-PRODUCT-REFERENCE-PACK-V1",
  "name": "Synthetic corporate product, pricing and solution reference pack",
  "domain": "product",
  "tier": "E_SYNTHETIC",
  "provider": "repository curated synthetic data",
  "dataset_version": "2026.07-demo-v2",
  "effective_from": "2026-01-01",
  "effective_to": "2026-12-31",
  "owner": {
    "business_owner": "MVP Product Owner",
    "data_steward": "MVP Product Data Steward",
    "technical_owner": "AI Engineering"
  },
  "purpose": {
    "allowed_uses": ["development", "automated_test", "offline_demo", "product_discovery"],
    "prohibited_uses": ["production_decision", "customer_communication_as_fact"]
  },
  "decision_role": "EVALUATION_ONLY",
  "access": {
    "method": "FILE",
    "endpoint_or_location": "data/raw_csv_json + data/mock_documents",
    "authentication": "repository ACL",
    "sandbox_available": true,
    "quota": null,
    "sla": null
  },
  "governance": {
    "legal_basis_or_license": "Project-owned synthetic content",
    "sensitivity": "INTERNAL",
    "retention": "project lifetime",
    "residency": "local development workspace",
    "cross_border": false,
    "approved": true,
    "approval_reference": "MVP-SYNTHETIC-DATA-ONLY"
  },
  "freshness": {
    "update_cadence": "manual per demo release",
    "max_age_seconds": 31536000,
    "stale_behavior": "MANUAL_REVIEW"
  },
  "identifiers": {
    "primary_key": "product_id/document_id",
    "join_keys": ["product_id", "source_id"],
    "canonical_internal_id": "PRD-*"
  },
  "quality": {
    "required_checks": ["utf8", "schema", "uniqueness", "product_reference", "effective_date", "lineage", "prompt_injection"],
    "publish_gate": "all deterministic checks pass"
  },
  "lineage": {
    "ingestion_job": "services.rag_mcp.ingestion:product_reference_pack",
    "raw_location": "data/raw_csv_json;data/mock_documents",
    "silver_location": "data/rag_mcp/rag.sqlite3",
    "gold_location": "MCP /mcp/product",
    "consumer_artifacts": ["ProductExpert/ExpertFinding"]
  },
  "lifecycle_status": "ACTIVE",
  "risks_and_notes": [
    "All prices, limits and product terms are synthetic examples.",
    "Product Expert may recommend candidates but may not decide legal eligibility."
  ]
}
