{
  "schema_version":"2.0.0","source_id":"SYNTHETIC-ELIGIBILITY-RULES-V2","name":"Synthetic eligibility and legal rule registry","domain":"legal","tier":"E_SYNTHETIC","provider":"repository synthetic data",
  "owner":{"business_owner":"MVP Risk Owner","data_steward":"MVP Legal Steward","technical_owner":"AI Engineering"},
  "purpose":{"allowed_uses":["development","automated_test","offline_demo"],"prohibited_uses":["production_credit_decision"]},
  "decision_role":"EVALUATION_ONLY",
  "access":{"method":"FILE","endpoint_or_location":"data/synthetic/v2/eligibility_rules.json","authentication":"repository access","sandbox_available":true},
  "governance":{"legal_basis_or_license":"Project-owned synthetic content","sensitivity":"INTERNAL","retention":"repository lifecycle","residency":"local development workspace","cross_border":false,"approved":true,"approval_reference":"MVP-SYNTHETIC-DATA-ONLY"},
  "freshness":{"update_cadence":"manual versioned release","max_age_seconds":31536000,"stale_behavior":"BLOCK_DECISION"},
  "identifiers":{"primary_key":"rule_id","join_keys":["version","source_document_id"]},
  "quality":{"required_checks":["schema","uniqueness","effective_date","source_evidence"],"publish_gate":"all deterministic checks pass"},
  "lineage":{"ingestion_job":"app.eligibility.registry.RuleRegistry","raw_location":"data/synthetic/v2/eligibility_rules.json","gold_location":"in-process versioned registry","consumer_artifacts":["EligibilityEngine"]},
  "lifecycle_status":"ACTIVE","risks_and_notes":["Synthetic only; requires Risk/Legal owner sign-off before pilot"]
}
