{
  "schema_version":"2.0.0","source_id":"SYNTHETIC-B2B-POLICIES-V2","name":"Synthetic B2B product policy pack","domain":"legal","tier":"E_SYNTHETIC","provider":"repository synthetic data",
  "owner":{"business_owner":"MVP Legal Owner","data_steward":"MVP Legal Steward","technical_owner":"AI Engineering"},
  "purpose":{"allowed_uses":["development","automated_test","offline_demo","legal_explanation"],"prohibited_uses":["production_legal_opinion","production_credit_decision"]},
  "decision_role":"EVALUATION_ONLY",
  "access":{"method":"FILE","endpoint_or_location":"data/synthetic/v2/b2b_policies.json","authentication":"repository access","sandbox_available":true},
  "governance":{"legal_basis_or_license":"Project-owned synthetic content","sensitivity":"INTERNAL","retention":"repository lifecycle","residency":"local development workspace","cross_border":false,"approved":true,"approval_reference":"MVP-SYNTHETIC-DATA-ONLY"},
  "freshness":{"update_cadence":"manual versioned release","max_age_seconds":31536000,"stale_behavior":"BLOCK_DECISION"},
  "identifiers":{"primary_key":"policy_id","join_keys":["product_ids","document_id","document_version","section_id"]},
  "quality":{"required_checks":["schema","synthetic_label","effective_date","product_scope","quote","acl","lineage"],"publish_gate":"all deterministic checks pass"},
  "lineage":{"ingestion_job":"app.knowledge.legal_service.LegalKnowledgeService","raw_location":"data/synthetic/v2/b2b_policies.json","gold_location":"data/vector_db/v2_legal.sqlite3","consumer_artifacts":["B2BPolicyRegistry","LegalKnowledgeService","EligibilityEngine"]},
  "lifecycle_status":"ACTIVE","risks_and_notes":["Synthetic demo content only; deterministic rules own outcomes"]
}
