{
  "schema_version": "2.0.0",
  "source_id": "SHB-RAG-KB-CORP-2026-01",
  "name": "SHB Corporate RAG Product Manual (public-source benchmark edition)",
  "domain": "product",
  "tier": "C_OPEN",
  "provider": "SHB_Corporate_RAG_Product_Manual_Public_Source_2026.odt",
  "owner": {
    "business_owner": "KHDN / SHB (public source)",
    "data_steward": "AI Engineering",
    "technical_owner": "AI Engineering"
  },
  "purpose": {
    "allowed_uses": ["development", "automated_test", "offline_demo", "benchmark"],
    "prohibited_uses": ["production_decision", "customer_communication_as_fact"]
  },
  "decision_role": "EVALUATION_ONLY",
  "access": {
    "method": "FILE",
    "endpoint_or_location": "data/synthetic/v2/products_shb.json",
    "authentication": "repository access",
    "sandbox_available": true
  },
  "governance": {
    "legal_basis_or_license": "Public-source benchmark corpus; not internal SHB policy. Re-verify against internal sources before any decision.",
    "sensitivity": "PUBLIC",
    "retention": "repository lifecycle",
    "residency": "local development workspace",
    "cross_border": false,
    "approved": true,
    "approval_reference": "RAG-KB-CORP-2026-01-PUBLIC-SOURCE"
  },
  "freshness": {
    "update_cadence": "manual versioned release",
    "max_age_seconds": 86400,
    "stale_behavior": "BLOCK_DECISION"
  },
  "identifiers": {
    "primary_key": "product_id",
    "join_keys": ["document_id", "document_version"]
  },
  "quality": {
    "required_checks": ["schema", "uniqueness", "effective_date", "lineage", "acl"],
    "publish_gate": "all deterministic checks pass"
  },
  "lineage": {
    "ingestion_job": "app.knowledge.ingestion.load_product_chunks",
    "raw_location": "data/synthetic/v2/products_shb.json",
    "gold_location": "data/vector_db/v2_products.sqlite3",
    "consumer_artifacts": ["ProductKnowledgeService", "ProductService"]
  },
  "lifecycle_status": "ACTIVE",
  "risks_and_notes": [
    "Public-source benchmark only. Fees/limits/promotions carry source_date and TTL 24h semantics; re-verify against internal catalog before advising.",
    "High-risk products (credit, guarantee, trade, card) must route through Legal/Credit review; branch_behavior=REVIEW_REQUIRED."
  ]
}
